<?xml version="1.0" encoding="windows-1251"?>
<documents xmlns:xsi="http://www.w3.org/2001/XMLSchema-instance"
           xsi:noNamespaceSchemaLocation="./../../../schemas/gate-documents-config.xsd">

	<document description="Биллинговый платеж"
              class="com.rssl.phizic.gate.payments.systems.AccountPaymentSystemPayment">
		<sender class="com.rssl.phizicgate.cpfl.documents.BillingPaymentSender"/>
	</document>

    <document description="Биллинговый платеж"
              class="com.rssl.phizic.gate.payments.systems.CardPaymentSystemPayment">
        <sender class="com.rssl.phizicgate.cpfl.documents.BillingPaymentSender"/>
    </document>

    <document description="ДП оплаты товаров и услуг с карты"
              class="com.rssl.phizic.gate.payments.longoffer.CardPaymentSystemPaymentLongOffer">
        <sender class="com.rssl.phizicgate.cpfl.documents.BillingPaymentSender"/>
    </document>

    <revoke-payment
            class="com.rssl.phizic.gate.documents.WithdrawDocument"
            document-type-field="withdrawType"/>
    
</documents>